{
  "reportVersion": "1.0.0",
  "stage": 1,
  "kind": "stage-gate",
  "status": "in_progress",
  "generatedAt": "2026-07-14T08:00:56.734Z",
  "acceptanceTarget": {
    "name": "Stage 1 contract freeze",
    "scope": "The immutable product, API, event, state, data, security, Profile, evaluation and pilot contracts required before foundation implementation.",
    "releaseEligible": false
  },
  "environment": {
    "runner": "local",
    "nodeVersion": "v22.15.0",
    "databaseImageDigest": "postgres@sha256:79c06d285ed9186efbbc45c73413b3c3510c3c94ffede2f25d1e523f74d07f28",
    "applicationImageDigest": null,
    "ciRunId": null
  },
  "versions": {
    "databaseSchema": {
      "version": "000001_contract_baseline",
      "ddlSha256": "12097031707ef544ac4d142e51c7e63b56a74facec30d9f5782e3fcbdb6f50e0",
      "verificationSha256": "c1e1ac14b287f632a2d5208437aa946bd7ad704bd6828b1e679bd0cc5dea9d7d"
    },
    "configurationSnapshot": {
      "snapshotId": "contract-d2187e1be3852b7d32fd",
      "contentRootSha256": "d2187e1be3852b7d32fd8eb3fd3701b964ab5799b8b7ea962b56e9ae5527703c"
    },
    "testData": [
      {
        "name": "bilingual-transition",
        "version": "1.0.0",
        "sha256": "d4964ace5ad970e38c21ccff7dd672887d274033f0232d5ee38c9b523430fe47",
        "sampleCount": 600
      },
      {
        "name": "fixed-safety",
        "version": "1.0.0",
        "sha256": "58674b95b92fb55962afa4f5d580cd89ded2e173483a7b561da9a23097801c15",
        "sampleCount": 500
      },
      {
        "name": "profile-coach",
        "version": "1.0.0",
        "sha256": "e38d1c50f426507d7468bc12334ca9d80573bf5570bc4427c5952ca820e183e2",
        "sampleCount": 200
      },
      {
        "name": "profile-route_planner",
        "version": "1.0.0",
        "sha256": "53157648b5bc77b40e7682dcbd7d8ce1c9d20cf15315348203cb80e482108cc7",
        "sampleCount": 200
      },
      {
        "name": "profile-daily_planner",
        "version": "1.0.0",
        "sha256": "242c5d7d6862e7c4e6ce6a4020c8c2bee982993f343e67cd8448c8a2180a2ec0",
        "sampleCount": 200
      },
      {
        "name": "profile-artifact_builder",
        "version": "1.0.0",
        "sha256": "0a64217ae659144e54185efa6187ec53947baa6ec712f7f028463f8cbea64ff9",
        "sampleCount": 200
      },
      {
        "name": "profile-evaluator",
        "version": "1.0.0",
        "sha256": "126d136cd8080c664a7f8d919dc8c29483b6c3af957b39d61b8b103159acb278",
        "sampleCount": 200
      }
    ]
  },
  "results": [
    {
      "id": "schema-lint",
      "status": "passed",
      "evidencePath": "gate-reports/stage-1/schema-lint.json",
      "evidenceSha256": "79386b8274983a5dd6924fd1438db2cee965a2a11705ce19a09c83af94348677",
      "summary": "143/143 contract checks passed"
    },
    {
      "id": "database-contract-smoke",
      "status": "passed",
      "evidencePath": "gate-reports/stage-1/database-smoke.json",
      "evidenceSha256": "e41eedb5ff89c9ccd719aafc66d28fc1c44815d214a38d6b62dbe7f451b2f87c",
      "summary": "92 tables; cross-tenant visible rows 0"
    },
    {
      "id": "traceability",
      "status": "passed",
      "evidencePath": "contracts/traceability/requirements.json",
      "evidenceSha256": "1c4c4fd6a07e4a3e3b9e830bb7713ed8428b264f2888b85e4884e03c79903aef",
      "summary": "43 top-level requirements traced"
    },
    {
      "id": "main-journeys",
      "status": "passed",
      "evidencePath": "contracts/traceability/main-journeys.json",
      "evidenceSha256": "79a080680396999ccad31bb238e2587e94e8fe7f8281a78f6118dbfd0ebf7ccc",
      "summary": "5/5 required journeys traced"
    },
    {
      "id": "review-issues",
      "status": "passed",
      "evidencePath": "gate-reports/stage-1/review-issues.json",
      "evidenceSha256": "0e6949b1ae7340e459ac795df0c881e474512cc188aaf82a1b3326f649620a6f",
      "summary": "open P0=0; open P1=0"
    },
    {
      "id": "accountable-approvals",
      "status": "pending",
      "evidencePath": "gate-reports/stage-1/approval-verification.json",
      "evidenceSha256": "1d85dfa98240a04fc137758ffa9f39d66192f5767f0a958bb4d38a1cca4e695c",
      "summary": "immutable source commit and five accountable approvals are pending"
    }
  ],
  "failures": [],
  "repairCommits": [
    {
      "issueId": "CONTRACT-REVIEW-001",
      "commit": "62329182ca34ab9bfba95d9e376c2093b6a9b715",
      "evidence": "gate-reports/stage-1/schema-lint.json"
    },
    {
      "issueId": "CONTRACT-REVIEW-002",
      "commit": "62329182ca34ab9bfba95d9e376c2093b6a9b715",
      "evidence": "gate-reports/stage-1/schema-lint.json"
    },
    {
      "issueId": "CONTRACT-REVIEW-003",
      "commit": "62329182ca34ab9bfba95d9e376c2093b6a9b715",
      "evidence": "gate-reports/stage-1/database-smoke.json"
    },
    {
      "issueId": "CONTRACT-REVIEW-004",
      "commit": "62329182ca34ab9bfba95d9e376c2093b6a9b715",
      "evidence": "gate-reports/stage-1/schema-lint.json"
    },
    {
      "issueId": "CONTRACT-REVIEW-005",
      "commit": "62329182ca34ab9bfba95d9e376c2093b6a9b715",
      "evidence": "gate-reports/stage-1/database-smoke.json"
    },
    {
      "issueId": "CONTRACT-REVIEW-006",
      "commit": "62329182ca34ab9bfba95d9e376c2093b6a9b715",
      "evidence": "gate-reports/stage-1/database-smoke.json"
    }
  ],
  "sourceCommit": "62329182ca34ab9bfba95d9e376c2093b6a9b715",
  "evidenceCommit": "62329182ca34ab9bfba95d9e376c2093b6a9b715",
  "snapshot": {
    "snapshotId": "contract-d2187e1be3852b7d32fd",
    "contentRootSha256": "d2187e1be3852b7d32fd8eb3fd3701b964ab5799b8b7ea962b56e9ae5527703c",
    "reviewPacketHash": "bef64424085f1410ab5b3c07b03188cb752a7c7418a4aeec652809530bd5471f"
  },
  "approvals": [],
  "blockers": [
    "product, frontend, backend, security and QA approvals bound to the review packet"
  ],
  "reportHash": "d105cc0aef901f3684722ee6e2648a0dc7629490847399a1284c5f5e73a50fbb"
}
